Title,Rating,Studio,Adaptation,Genre,Duration,Show Type,No of Episodes,Year of Release
Fullmetal Alchemist: Brotherhood,4.53 Masterpiece,BONES Inc.,Manga,Adventure,~25min,TV-Series,64,2009
Frieren: Beyond Journey’s End,4.52 Masterpiece,MADHOUSE Inc.,Manga,Adventure,~25min,TV-Series,28,2023
The Apothecary Diaries: Season 2,4.51 Masterpiece,"OLM, Inc., TOHO animation STUDIO Co., Ltd.",Light Novel,Drama,~24min,TV-Series,24,2025
Code Geass: Lelouch of the Rebellion R2,4.49 Masterpiece,SUNRISE Inc.,Original Work,Action Drama,~24min,TV-Series,25,2008
Death Note,4.49 Masterpiece,MADHOUSE Inc.,Manga,Supernatural Thriller,~23min,TV-Series,37,2006
Solo Leveling: Arise from the Shadow,4.49 Masterpiece,A-1 Pictures Inc.,Webtoon,Adventure,~24min,TV-Series,13,2025
The Apothecary Diaries,4.49 Masterpiece,"OLM, Inc., TOHO animation STUDIO Co., Ltd.",Light Novel,Drama,~23min,TV-Series,24,2023
Attack on Titan: Season 3 (Part 2),4.46 Masterpiece,"WIT STUDIO, Inc.",Manga,Action Drama,~24min,TV-Series,10,2019
Demon Slayer: Kimetsu no Yaiba - Entertainment District Arc,4.45 Masterpiece,"ufotable, Inc.",Manga,Action Drama,~27min,TV-Series,11,2021
Code Geass: Lelouch of the Rebellion,4.44 Masterpiece,SUNRISE Inc.,Original Work,Action Drama,~24min,TV-Series,25,2006
Steins;Gate,4.43 Masterpiece,"WHITE FOX Co., Ltd.",Visual Novel,Supernatural Thriller,~24min,TV-Series,24,2011
Clannad: After Story,4.41 Masterpiece,"Kyoto Animation Co., Ltd.",Visual Novel,Sentimental Drama,~24min,TV-Series,24,2008
Fruits Basket: The Final Season,4.43 Masterpiece,"TMS Entertainment Co., Ltd.",Manga,Drama,~24min,TV-Series,13,2021
GTO: Great Teacher Onizuka,4.41 Masterpiece,"Pierrot Co., Ltd.",Manga,Drama,~26min,TV-Series,43,1999
Oshi no Ko,4.39 Masterpiece,Doga Kobo,Manga,Sentimental Drama,~30min,TV-Series,11,2023
Attack on Titan: Final Season Part 2,4.37 Masterpiece,"MAPPA Co., Ltd.",Manga,Action Drama,~24min,TV-Series,12,2022
That Time I Got Reincarnated as a Slime: Season 2,4.37 Masterpiece,"8bit Corp, Inc.",Light Novel,Adventure,~24min,TV-Series,12,2021
Gintama (Episodes 266-316),4.37 Masterpiece,BANDAI NAMCO Pictures Inc.,Manga,Nonsense-Comedy,~24min,TV-Series,51,2015
Erased,4.35 Masterpiece,A-1 Pictures Inc.,Manga,Supernatural Thriller,~23min,TV-Series,12,2016
Mushoku Tensei: Jobless Reincarnation (Part 2),4.35 Masterpiece,"StudioBind Co., Ltd.",Light Novel,Adventure,~24min,TV-Series,12,2021
Gintama (Episodes 253-265),4.36 Masterpiece,SUNRISE Inc.,Manga,Nonsense-Comedy,~24min,TV-Series,13,2012
Bleach: Thousand-Year Blood War,4.37 Masterpiece,"Pierrot Co., Ltd.",Manga,Fighting-Shounen,~25min,TV-Series,13,2022
Attack on Titan: Final Season,4.35 Masterpiece,"MAPPA Co., Ltd.",Manga,Action Drama,~24min,TV-Series,16,2020
Oshi no Ko 2,4.36 Masterpiece,Doga Kobo,Manga,Drama,~24min,TV-Series,13,2024
The Dangers in My Heart: Season 2,4.36 Masterpiece,"Shin-ei Animation Co., Ltd.",Manga,Romantic Comedy,~23min,TV-Series,13,2024
Kaguya-sama: Love Is War - Ultra Romantic,4.35 Masterpiece,A-1 Pictures Inc.,Manga,Romantic Comedy,~25min,TV-Series,13,2022
That Time I Got Reincarnated as a Slime: Season 2 (Part 2),4.34 Masterpiece,"8bit Corp, Inc.",Light Novel,Adventure,~24min,TV-Series,12,2021
Hunter × Hunter (2011),4.34 Masterpiece,MADHOUSE Inc.,Manga,Fighting-Shounen,~24min,TV-Series,148,2011
Demon Slayer: Kimetsu no Yaiba,4.33 Masterpiece,"ufotable, Inc.",Manga,Action Drama,~24min,TV-Series,26,2019
Haikyu!! To the Top (Part 2),4.34 Masterpiece,"Production I.G., Inc.",Manga,Ganbatte,~24min,TV-Series,12,2020
Attack on Titan: Season 3,4.33 Masterpiece,"WIT STUDIO, Inc.",Manga,Action Drama,~24min,TV-Series,12,2018
Demon Slayer: Kimetsu no Yaiba - Swordsmith Village Arc,4.33 Masterpiece,"ufotable, Inc.",Manga,Action Drama,~29min,TV-Series,11,2023
Mushi-Shi: The Next Passage 2,4.34 Masterpiece,Animation Studio Artland Inc.,Manga,Drama,~24min,TV-Series,10,2014
Haikyu!! 3rd Season,4.33 Masterpiece,"Production I.G., Inc.",Manga,Ganbatte,~24min,TV-Series,10,2016
Gintama (Episodes 202-252),4.33 Masterpiece,SUNRISE Inc.,Manga,Nonsense-Comedy,~25min,TV-Series,51,2011
Gintama (Episodes 317-328),4.34 Masterpiece,BANDAI NAMCO Pictures Inc.,Manga,Nonsense-Comedy,~24min,TV-Series,12,2017
Attack on Titan,4.31 Masterpiece,"WIT STUDIO, Inc.",Manga,Action Drama,~24min,TV-Series,25,2013
Demon Slayer: Kimetsu no Yaiba - Mugen Train Arc,4.31 Masterpiece,"ufotable, Inc.",Manga,Action Drama,~24min,TV-Series,7,2021
My Hero Academia Season 6,4.31 Masterpiece,BONES Inc.,Manga,Action Comedy,~24min,TV-Series,25,2022
My Dress-Up Darling,4.29 Masterpiece,CloverWorks Inc.,Manga,Romantic Comedy,~24min,TV-Series,12,2022
Mushi-Shi: The Next Passage,4.30 Masterpiece,Animation Studio Artland Inc.,Manga,Drama,~24min,TV-Series,11,2014
Hajime no Ippo: The Fighting! - New Challenger,4.29 Masterpiece,MADHOUSE Inc.,Manga,Ganbatte,~25min,TV-Series,26,2009
That Time I Got Reincarnated as a Slime,4.29 Masterpiece,"8bit Corp, Inc.",Light Novel,Adventure,~24min,TV-Series,24,2018
Haikyu!! 2nd Season,4.29 Masterpiece,"Production I.G., Inc.",Manga,Ganbatte,~24min,TV-Series,25,2015
Jujutsu Kaisen,4.29 Masterpiece,"MAPPA Co., Ltd.",Manga,Fighting-Shounen,~24min,TV-Series,24,2020
Fighting Spirit,4.28 Masterpiece,MADHOUSE Inc.,Manga,Ganbatte,~24min,TV-Series,75,2000
Fruits Basket Season 2,4.29 Masterpiece,"TMS Entertainment Co., Ltd.",Manga,Drama,~24min,TV-Series,25,2020
Kaiju No. 8,4.28 Masterpiece,"Production I.G., Inc.",Manga,Action Comedy,~24min,TV-Series,12,2024
Mushoku Tensei: Jobless Reincarnation,4.28 Masterpiece,"StudioBind Co., Ltd.",Light Novel,Adventure,~24min,TV-Series,11,2021
Solo Leveling,4.28 Masterpiece,A-1 Pictures Inc.,Webtoon,Adventure,~24min,TV-Series,12,2024
Attack on Titan: Season 2,4.27 Masterpiece,"WIT STUDIO, Inc.",Manga,Action Drama,~24min,TV-Series,12,2017
One Punch Man,4.27 Masterpiece,MADHOUSE Inc.,Manga,Action Comedy,~24min,TV-Series,12,2015
Bunny Drop,4.27 Masterpiece,"Production I.G., Inc.",Manga,Slice of Life Drama,~23min,TV-Series,11,2011
Jujutsu Kaisen: Season 2,4.27 Masterpiece,"MAPPA Co., Ltd.",Manga,Action Drama,~24min,TV-Series,23,2023
Your Lie in April,4.26 Masterpiece,A-1 Pictures Inc.,Manga,Sentimental Drama,~23min,TV-Series,22,2014
The Rising of the Shield Hero,4.26 Masterpiece,"Kinema Citrus Co., Ltd.",Light Novel,Adventure,~25min,TV-Series,25,2018
Made in Abyss: The Golden City of the Scorching Sun,4.26 Masterpiece,"Kinema Citrus Co., Ltd.",Manga,Adventure,~26min,TV-Series,12,2022
Spy × Family,4.26 Masterpiece,"CloverWorks Inc., WIT STUDIO, Inc.",Manga,Action Comedy,~24min,TV-Series,12,2022
Violet Evergarden,4.25 Masterpiece,"Kyoto Animation Co., Ltd.",Light Novel,Sentimental Drama,~24min,TV-Series,13,2018
Haikyu!! To the Top,4.25 Masterpiece,"Production I.G., Inc.",Manga,Ganbatte,~24min,TV-Series,13,2020
My Hero Academia Season 3,4.24 Masterpiece,BONES Inc.,Manga,Action Comedy,~24min,TV-Series,25,2018
Toradora!,4.24 Masterpiece,"J.C.STAFF Co., Ltd.",Light Novel,Romantic Comedy,~24min,TV-Series,25,2008
Vinland Saga,4.24 Masterpiece,"WIT STUDIO, Inc.",Manga,Adventure,~25min,TV-Series,24,2019
Hajime no Ippo: The Fighting! Rising,4.25 Masterpiece,"MADHOUSE Inc., MAPPA Co., Ltd.",Manga,Ganbatte,~24min,TV-Series,25,2013
The Promised Neverland,4.24 Masterpiece,CloverWorks Inc.,Manga,Supernatural Thriller,~23min,TV-Series,12,2019
86: Eighty Six (Season 2),4.24 Masterpiece,A-1 Pictures Inc.,Light Novel,Action Drama,~24min,TV-Series,12,2021
Kaguya-sama: Love Is War?,4.23 Masterpiece,A-1 Pictures Inc.,Manga,Romantic Comedy,~25min,TV-Series,12,2020
Spice and Wolf: Season 2,4.22 Excellent,"Brain’s Base, Marvy Jack",Light Novel,Adventure,~24min,TV-Series,12,2009
My Hero Academia Season 2,4.22 Excellent,BONES Inc.,Manga,Action Comedy,~24min,TV-Series,25,2017
March Comes in Like a Lion Season 2,4.23 Masterpiece,SHAFT Inc.,Manga,Drama,~25min,TV-Series,22,2017
Mushoku Tensei: Jobless Reincarnation - Season 2 Cour 2,4.22 Excellent,"StudioBind Co., Ltd.",Light Novel,Adventure,~24min,TV-Series,12,2024
Is It Wrong to Try to Pick Up Girls in a Dungeon? IV - Part 2,4.22 Excellent,"J.C.STAFF Co., Ltd.",Light Novel,Action Comedy,~24min,TV-Series,11,2023
Horimiya,4.21 Excellent,CloverWorks Inc.,Manga,Romantic Comedy,~24min,TV-Series,13,2021
My Hero Academia Season 4,4.21 Excellent,BONES Inc.,Manga,Action Comedy,~24min,TV-Series,25,2019
The Eminence in Shadow: Season 2,4.21 Excellent,Nexus,Light Novel,Action Comedy,~24min,TV-Series,12,2023
Gintama (Episodes 342-353),4.24 Masterpiece,BANDAI NAMCO Pictures Inc.,Manga,Nonsense-Comedy,~24min,TV-Series,12,2018
Kingdom Season 3,4.27 Masterpiece,"Pierrot Co., Ltd., St.Signpost.CO.,Ltd.",Manga,Action,~25min,TV-Series,26,2020
Gintama (Episodes 354-367),4.24 Masterpiece,BANDAI NAMCO Pictures Inc.,Manga,Nonsense-Comedy,~24min,TV-Series,14,2018
Made in Abyss,4.20 Excellent,"Kinema Citrus Co., Ltd.",Manga,Adventure,~26min,TV-Series,13,2017
Nana,4.20 Excellent,MADHOUSE Inc.,Manga,Romantic Drama,~23min,TV-Series,47,2006
Mushoku Tensei: Jobless Reincarnation - Season 2,4.20 Excellent,"StudioBind Co., Ltd.",Light Novel,Adventure,~24min,TV-Series,12,2023
Ascendance of a Bookworm (Part 2),4.20 Excellent,"AJIADO CO.,LTD.",Light Novel,Slice of Life Drama,~24min,TV-Series,12,2020
Haikyu!!,4.19 Excellent,"Production I.G., Inc.",Manga,Ganbatte,~24min,TV-Series,25,2014
Parasyte: The Maxim,4.19 Excellent,MADHOUSE Inc.,Manga,Action Drama,~23min,TV-Series,24,2014
Dr. Stone,4.19 Excellent,"TMS Entertainment Co., Ltd.",Manga,Adventure Comedy,~24min,TV-Series,24,2019
Bocchi the Rock!,4.19 Excellent,CloverWorks Inc.,Manga,Slice of Life Comedy,~24min,TV-Series,12,2022
One Piece,4.18 Excellent,"Toei Animation Co., Ltd.",Manga,Fighting-Shounen,~24min,TV-Series,1150,1999
Food Wars! Shokugeki no Soma,4.18 Excellent,"J.C.STAFF Co., Ltd.",Manga,Ganbatte,~25min,TV-Series,24,2015
Bakuman Season 3,4.18 Excellent,"J.C.STAFF Co., Ltd.",Manga,Ganbatte,~24min,TV-Series,25,2012
Ascendance of a Bookworm (Part 3),4.18 Excellent,"AJIADO CO.,LTD.",Light Novel,Slice of Life Drama,~24min,TV-Series,10,2022
Re:Zero - Starting Life in Another World: Director’s Cut,4.18 Excellent,"WHITE FOX Co., Ltd.",Light Novel,Drama,~51min,TV-Series,13,2020
Dr. Stone: Stone Wars,4.17 Excellent,"TMS Entertainment Co., Ltd.",Manga,Adventure,~24min,TV-Series,11,2021
Dr. Stone: New World (Cour 2),4.17 Excellent,"TMS Entertainment Co., Ltd.",Manga,Adventure,~24min,TV-Series,11,2023
Dan Da Dan,4.17 Excellent,Science SARU Inc.,Manga,Action,~24min,TV-Series,12,2024
Food Wars! The Third Plate (Totsuki Train-Arc),4.17 Excellent,"J.C.STAFF Co., Ltd.",Manga,Ganbatte,~24min,TV-Series,12,2018
Food Wars! The Third Plate,4.16 Excellent,"J.C.STAFF Co., Ltd.",Manga,Ganbatte,~24min,TV-Series,12,2017
Demon Slayer: Kimetsu no Yaiba - Hashira Training Arc,4.17 Excellent,"ufotable, Inc.",Manga,Action Drama,~30min,TV-Series,8,2024
Monster,4.16 Excellent,MADHOUSE Inc.,Manga,Thriller,~24min,TV-Series,74,2004
Mushi-Shi,4.16 Excellent,Artland Inc.,Manga,Drama,~24min,TV-Series,26,2005
Laid-Back Camp Season 2,4.17 Excellent,"C-Station Co., Ltd",Manga,Slice of Life Comedy,~24min,TV-Series,13,2021
Dororo,4.06 Excellent,"MAPPA Co., Ltd., Tezuka Productions Co., Ltd.",Manga,Adventure,~24min,TV-Series,24,2019
Mobile Suit Gundam 00 Second Season,4.06 Excellent,SUNRISE Inc.,Original Work,Action Drama,~24min,TV-Series,25,2008
My Teen Romantic Comedy SNAFU: Climax!,4.06 Excellent,feel.,Light Novel,Slice of Life Drama,~24min,TV-Series,12,2020
Magi: The Kingdom of Magic,4.05 Excellent,A-1 Pictures Inc.,Manga,Adventure,~25min,TV-Series,25,2013
The Ancient Magus’ Bride: Season 2 (Cour 2),4.07 Excellent,"Studio KAFKA Co., Ltd.",Manga,Supernatural Drama,~24min,TV-Series,12,2023
JoJo’s Bizarre Adventure: Stardust Crusaders - Battle in Egypt,4.06 Excellent,David Production Inc.,Manga,Fighting-Shounen,~23min,TV-Series,24,2015
Full Metal Panic? Fumoffu,4.05 Excellent,"Kyoto Animation Co., Ltd.",Light Novel,Comedy,~24min,TV-Series,12,2003
Girls Band Cry,4.11 Excellent,"Toei Animation Co., Ltd.",Original Work,Drama,~24min,TV-Series,13,2024
Chihayafuru Season 3,4.08 Excellent,MADHOUSE Inc.,Manga,Ganbatte,~23min,TV-Series,24,2019
To Your Eternity,4.05 Excellent,Brain’s Base,Manga,Drama,~25min,TV-Series,20,2021
Is It Wrong to Try to Pick Up Girls in a Dungeon? IV,4.05 Excellent,"J.C.STAFF Co., Ltd.",Light Novel,Action Comedy,~24min,TV-Series,11,2022
The Seven Deadly Sins: Revival of The Commandments,4.05 Excellent,A-1 Pictures Inc.,Manga,Adventure,~24min,TV-Series,24,2018
Natsume’s Book of Friends: Season 3,4.05 Excellent,Brain’s Base,Manga,Slice of Life Drama,~24min,TV-Series,13,2011
Kingdom Season 2,4.06 Excellent,"Pierrot Co., Ltd.",Manga,Action,~25min,TV-Series,39,2013
Clannad,4.04 Excellent,"Kyoto Animation Co., Ltd.",Visual Novel,Sentimental Drama,~24min,TV-Series,23,2007
When They Cry,4.04 Excellent,"Studio DEEN Co., Ltd.",Visual Novel,Horror,~24min,TV-Series,26,2006
Golden Kamuy 3,4.06 Excellent,Geno Studio Inc.,Manga,Adventure,~24min,TV-Series,12,2020
The Fable,4.08 Excellent,"Tezuka Productions Co., Ltd.",Manga,Action,~23min,TV-Series,25,2024
When They Cry: Kai,4.04 Excellent,"Studio DEEN Co., Ltd.",Visual Novel,Drama,~24min,TV-Series,24,2007
Fruits Basket: Season 1,4.04 Excellent,"TMS Entertainment Co., Ltd.",Manga,Drama,~24min,TV-Series,25,2019
Fairy Tail,4.03 Excellent,"A-1 Pictures Inc., Satelight Inc.",Manga,Fighting-Shounen,~24min,TV-Series,175,2009
Sword Art Online: Alicization - War of Underworld,4.03 Excellent,A-1 Pictures Inc.,Light Novel,Action Drama,~24min,TV-Series,12,2019
Moriarty the Patriot Cour 2,4.05 Excellent,"Production I.G., Inc.",Manga,Drama,~24min,TV-Series,13,2021
Eureka Seven,4.03 Excellent,BONES Inc.,Original Work,Action Drama,~24min,TV-Series,50,2005
Natsume’s Book of Friends: Season 2,4.04 Excellent,Brain’s Base,Manga,Ghost Stories,~24min,TV-Series,13,2009
Given,4.04 Excellent,Lerche,Manga,Romantic Drama,~23min,TV-Series,11,2019
Neon Genesis Evangelion,4.02 Excellent,"Gainax Co., Ltd., Tatsunoko Production Co., Ltd.",Original Work,Action Drama,~24min,TV-Series,26,1995
Owarimonogatari,4.04 Excellent,SHAFT Inc.,Light Novel,Ghost Stories,~25min,TV-Series,12,2015
Overlord,4.02 Excellent,MADHOUSE Inc.,Light Novel,Action,~24min,TV-Series,13,2015
Rainbow,4.02 Excellent,MADHOUSE Inc.,Manga,Action Drama,~23min,TV-Series,26,2010
The Pet Girl of Sakurasou,4.02 Excellent,"J.C.STAFF Co., Ltd.",Light Novel,Romantic Comedy,~24min,TV-Series,24,2012
Spy × Family: Season 2,4.03 Excellent,"CloverWorks Inc., WIT STUDIO, Inc.",Manga,Action Comedy,~24min,TV-Series,12,2023
Major 6th Season,4.04 Excellent,"SynergySP Co. ,Ltd.",Manga,Ganbatte,~25min,TV-Series,25,2010
Angel Beats!,4.02 Excellent,"P.A. Works Co., Ltd.",Original Work,Sentimental Drama,~25min,TV-Series,13,2010
Kamisama Kiss 2,4.03 Excellent,"TMS Entertainment Co., Ltd.",Manga,Romantic Comedy,~24min,TV-Series,12,2015
Terror in Resonance,4.02 Excellent,"MAPPA Co., Ltd.",Original Work,Thriller,~23min,TV-Series,11,2014
Sasaki and Miyano,4.05 Excellent,"Studio DEEN Co., Ltd.",Manga,Comedy,~24min,TV-Series,12,2022
My Happy Marriage,4.03 Excellent,"Kinema Citrus Co., Ltd.",Light Novel,Romantic Drama,~24min,TV-Series,12,2023
Real Girl (Cour 2),4.04 Excellent,Hoods Entertainment Inc.,Manga,Romantic Drama,~23min,TV-Series,12,2019
Bakuman.,4.02 Excellent,"J.C.STAFF Co., Ltd.",Manga,Ganbatte,~24min,TV-Series,25,2010
Insomniacs after School,4.04 Excellent,LIDEN FILMS Inc.,Manga,Slice of Life Drama,~24min,TV-Series,13,2023
Vivy: Fluorite Eye’s Song,4.03 Excellent,"WIT STUDIO, Inc.",Original Work,Action Drama,~23min,TV-Series,13,2021
Tokyo Revengers: Tenjiku Arc,4.04 Excellent,LIDEN FILMS Inc.,Manga,Action Drama,~24min,TV-Series,13,2023
Mobile Suit Gundam: Iron-Blooded Orphans 2,4.04 Excellent,SUNRISE Inc.,Original Work,Action Drama,~25min,TV-Series,25,2016
One Outs,4.02 Excellent,MADHOUSE Inc.,Manga,Thriller,~23min,TV-Series,25,2008
Tsukigakirei,4.02 Excellent,feel.,Original Work,Romance,~24min,TV-Series,12,2017
Moriarty the Patriot,4.03 Excellent,"Production I.G., Inc.",Manga,Drama,~24min,TV-Series,11,2020
Aoashi,4.04 Excellent,"Production I.G., Inc.",Manga,Ganbatte,~25min,TV-Series,24,2022
Snow White with the Red Hair Season 2,4.02 Excellent,BONES Inc.,Manga,Romance,~24min,TV-Series,12,2016
Junjo Romantica 2,4.02 Excellent,"Studio DEEN Co., Ltd.",Manga,Romance,~24min,TV-Series,12,2008
Blue Box,4.03 Excellent,"Telecom Animation Film Co., Ltd.",Manga,Romance,~24min,TV-Series,25,2024
Showa Genroku Rakugo Shinju,4.03 Excellent,"Studio DEEN Co., Ltd.",Manga,Drama,~26min,TV-Series,13,2016
Golden Kamuy 2,4.02 Excellent,Geno Studio Inc.,Manga,Adventure,~24min,TV-Series,12,2018
A Certain Scientific Railgun T,4.02 Excellent,"J.C.STAFF Co., Ltd.",Manga,Action,~24min,TV-Series,25,2020
Log Horizon,4.00 Excellent,Satelight Inc.,Light Novel,Adventure,~25min,TV-Series,25,2013
Darling in the Franxx,4.00 Excellent,"CloverWorks Inc., TRIGGER Inc.",Original Work,Action Drama,~24min,TV-Series,24,2018
Cowboy Bebop,4.00 Excellent,SUNRISE Inc.,Original Work,Action,~25min,TV-Series,26,1998
Black Butler: Book of Circus,4.01 Excellent,A-1 Pictures Inc.,Manga,Action Drama,~24min,TV-Series,10,2014
Chihayafuru Season 2,4.01 Excellent,MADHOUSE Inc.,Manga,Ganbatte,~23min,TV-Series,25,2013
The Ancient Magus’ Bride,4.00 Excellent,"WIT STUDIO, Inc.",Manga,Supernatural Drama,~24min,TV-Series,24,2017
Bakemonogatari,4.00 Excellent,SHAFT Inc.,Light Novel,Ghost Stories,~24min,TV-Series,15,2009
To Your Eternity: Season 2,4.02 Excellent,Drive Inc.,Manga,Drama,~25min,TV-Series,20,2022
Sword Art Online: Alicization,4.00 Excellent,A-1 Pictures Inc.,Light Novel,Action Drama,~25min,TV-Series,24,2018
Baccano!,4.00 Excellent,Brain’s Base,Light Novel,Action,~25min,TV-Series,13,2007
Tsukimichi: Moonlit Fantasy,4.00 Excellent,"C2C Co., Ltd.",Light Novel,Adventure,~24min,TV-Series,12,2021
Tonikawa: Over the Moon for You,4.00 Excellent,Seven Arcs Ltd.,Manga,Romantic Comedy,~24min,TV-Series,12,2020
Gintama,4.00 Excellent,SUNRISE Inc.,Manga,Nonsense-Comedy,~25min,TV-Series,201,2006
One Punch Man Season 2,4.00 Excellent,"J.C.STAFF Co., Ltd.",Manga,Action Comedy,~24min,TV-Series,12,2019
Mob Psycho 100,4.00 Excellent,BONES Inc.,Manga,Action Comedy,~24min,TV-Series,12,2016
Sekai Ichi Hatsukoi: World’s Greatest First Love,4.00 Excellent,"Studio DEEN Co., Ltd.",Manga,Romance,~24min,TV-Series,12,2011
Classroom of the Elite,4.00 Excellent,Lerche,Light Novel,Drama,~24min,TV-Series,12,2017
Berserk,4.00 Excellent,"OLM, Inc.",Manga,Action Drama,~24min,TV-Series,25,1997
The Ancient Magus’ Bride: Season 2,4.01 Excellent,"Studio KAFKA Co., Ltd.",Manga,Supernatural Drama,~24min,TV-Series,12,2023
Is It Wrong to Try to Pick Up Girls in a Dungeon? V,4.02 Excellent,"J.C.STAFF Co., Ltd.",Light Novel,Action Comedy,~24min,TV-Series,15,2024
Nodame Cantabile,4.00 Excellent,"J.C.STAFF Co., Ltd.",Manga,Romantic Comedy,~24min,TV-Series,23,2007
Assassination Classroom,3.99 Excellent,Lerche,Manga,Action Comedy,~23min,TV-Series,22,2015
KonoSuba: God’s Blessing on This Wonderful World! 3,4.00 Excellent,Drive Inc.,Light Novel,Adventure,~24min,TV-Series,11,2024
Sound! Euphonium 2,4.00 Excellent,"Kyoto Animation Co., Ltd.",Novel,Slice of Life Drama,~26min,TV-Series,13,2016
Classroom of the Elite: Season 3,3.99 Excellent,Lerche,Light Novel,Drama,~24min,TV-Series,13,2024
Samurai Champloo,3.99 Excellent,manglobe Inc.,Original Work,Adventure,~23min,TV-Series,26,2004
Is It Wrong to Try to Pick Up Girls in a Dungeon? III,3.99 Excellent,"J.C.STAFF Co., Ltd.",Light Novel,Action Drama,~24min,TV-Series,12,2020
My Teen Romantic Comedy SNAFU: TOO!,3.99 Excellent,feel.,Light Novel,Slice of Life Drama,~24min,TV-Series,13,2015
Sword Art Online: Alicization - War of Underworld Part 2,3.99 Excellent,A-1 Pictures Inc.,Light Novel,Action Drama,~24min,TV-Series,11,2020
Major 2nd Season,3.99 Excellent,"Studio Hibari Co., Ltd.",Manga,Ganbatte,~25min,TV-Series,26,2005
Fire Force Season 2,3.99 Excellent,David Production Inc.,Manga,Action,~24min,TV-Series,24,2020
KonoSuba: God’s Blessing on This Wonderful World! 2,3.98 Excellent,"Studio DEEN Co., Ltd.",Light Novel,Adventure Comedy,~24min,TV-Series,10,2017
Bloom into You,3.99 Excellent,TROYCA Inc.,Manga,Romantic Drama,~24min,TV-Series,13,2018
Carole & Tuesday,3.99 Excellent,BONES Inc.,Original Work,Drama,~23min,TV-Series,24,2019
Mobile Suit Gundam 00,3.98 Excellent,SUNRISE Inc.,Original Work,Action Drama,~24min,TV-Series,25,2007
The Future Diary,3.98 Excellent,asread,Manga,Thriller,~24min,TV-Series,26,2011
The Case Study of Vanitas (Season 2),3.99 Excellent,BONES Inc.,Manga,Adventure,~24min,TV-Series,12,2022
Champion Joe 2,4.19 Excellent,"TMS Entertainment Co., Ltd.",Manga,Ganbatte,~24min,TV-Series,47,1980
The Melancholy of Haruhi Suzumiya,3.97 Excellent,"Kyoto Animation Co., Ltd.",Light Novel,Slice of Life Comedy,~24min,TV-Series,14,2006
Teasing Master Takagi-san 3,4.01 Excellent,"Shin-ei Animation Co., Ltd.",Manga,Romantic Comedy,~24min,TV-Series,12,2022
Major,3.98 Excellent,"Studio Hibari Co., Ltd.",Manga,Ganbatte,~25min,TV-Series,26,2004
Gate,3.97 Excellent,A-1 Pictures Inc.,Light Novel,Action,~24min,TV-Series,12,2015
Saga of Tanya the Evil,3.97 Excellent,Nut Inc.,Light Novel,Action,~24min,TV-Series,12,2017
Dan Da Dan: Season 2,4.03 Excellent,Science SARU Inc.,Manga,Action,~24min,TV-Series,12,2025
My Hero Academia Season 5,3.97 Excellent,BONES Inc.,Manga,Action Comedy,~24min,TV-Series,25,2021
Charlotte,3.97 Excellent,"P.A. Works Co., Ltd.",Original Work,Drama,~24min,TV-Series,13,2015
Kaleido Star,3.91 Excellent,Gonzo K.K.,Original Work,Ganbatte,~23min,TV-Series,51,2003
Date a Live IV,3.92 Excellent,GEEK TOYS Inc.,Light Novel,Action Comedy,~24min,TV-Series,12,2022
Makeine: Too Many Losing Heroines!,3.92 Excellent,A-1 Pictures Inc.,Light Novel,Romantic Comedy,~24min,TV-Series,12,2024
Arifureta: From Commonplace to World’s Strongest,3.90 Excellent,"WHITE FOX Co., Ltd., asread",Light Novel,Adventure,~24min,TV-Series,13,2019
Food Wars! The Fifth Plate,3.91 Excellent,"J.C.STAFF Co., Ltd.",Manga,Ganbatte,~24min,TV-Series,13,2020
Blue Exorcist: The Blue Night Saga,3.95 Excellent,"studio VOLN Co., Ltd.",Manga,Action,~24min,TV-Series,12,2025
Moribito: Guardian of the Spirit,3.90 Excellent,"Production I.G., Inc.",Novel,Adventure,~25min,TV-Series,26,2007
SK8 the Infinity,3.91 Excellent,BONES Inc.,Original Work,Ganbatte,~24min,TV-Series,12,2021
Jellyfish Can’t Swim in the Night,3.93 Excellent,Doga Kobo,Original Work,Slice of Life Drama,~24min,TV-Series,12,2024
Welcome to Demon-School! Iruma-kun: Season 2,3.91 Excellent,BANDAI NAMCO Pictures Inc.,Manga,Comedy,~25min,TV-Series,21,2021
Baby Steps 2,3.91 Excellent,"Pierrot Co., Ltd.",Manga,Ganbatte,~25min,TV-Series,25,2015
Legend of the Galactic Heroes: Die Neue These,3.92 Excellent,"Production I.G., Inc.",Novel,Action Drama,~25min,TV-Series,12,2018
Junjo Romantica,3.90 Excellent,"Studio DEEN Co., Ltd.",Manga,Romance,~24min,TV-Series,12,2008
Durarara!!,3.89 Excellent,Brain’s Base,Light Novel,Action,~25min,TV-Series,24,2010
Yona of the Dawn,3.89 Excellent,"Pierrot Co., Ltd.",Manga,Adventure,~24min,TV-Series,24,2014
Is It Wrong to Try to Pick Up Girls in a Dungeon? II,3.89 Excellent,"J.C.STAFF Co., Ltd.",Light Novel,Action Comedy,~24min,TV-Series,12,2019
Silver Spoon Season 2,3.90 Excellent,A-1 Pictures Inc.,Manga,Comedy,~24min,TV-Series,11,2014
Teasing Master Takagi-san: Season 2,3.90 Excellent,"Shin-ei Animation Co., Ltd.",Manga,Romantic Comedy,~24min,TV-Series,12,2019
Non Non Biyori Repeat,3.90 Excellent,SILVER LINK.,Manga,Slice of Life Comedy,~24min,TV-Series,12,2015
Gankutsuou: The Count of Monte Cristo,3.89 Excellent,Gonzo K.K.,Novel,Drama,~24min,TV-Series,24,2004
Ergo Proxy,3.89 Excellent,manglobe Inc.,Original Work,Action Drama,~25min,TV-Series,23,2006
Goblin Slayer,3.89 Excellent,"WHITE FOX Co., Ltd.",Light Novel,Action,~24min,TV-Series,12,2018
Zom 100: Bucket List of the Dead,3.89 Excellent,BUG FILMS,Manga,Action,~24min,TV-Series,12,2023
Hinamatsuri,3.89 Excellent,feel.,Manga,Nonsense-Comedy,~24min,TV-Series,12,2018
Blue Spring Ride,3.89 Excellent,"Production I.G., Inc.",Manga,Romantic Drama,~24min,TV-Series,12,2014
JoJo’s Bizarre Adventure: Stardust Crusaders,3.89 Excellent,David Production Inc.,Manga,Fighting-Shounen,~24min,TV-Series,24,2014
Clevatess,3.94 Excellent,Lay-duce Inc.,Manga,Action,~24min,TV-Series,12,2025
Wistoria: Wand and Sword,3.89 Excellent,"Actas Inc., BANDAI NAMCO Pictures Inc.",Manga,Action,~24min,TV-Series,12,2024
World Trigger 2nd Season,3.91 Excellent,"Toei Animation Co., Ltd.",Manga,Fighting-Shounen,~23min,TV-Series,12,2021
Hi Score Girl II,3.90 Excellent,"J.C.STAFF Co., Ltd.",Manga,Romantic Comedy,~24min,TV-Series,9,2019
How a Realist Hero Rebuilt the Kingdom,3.88 Excellent,"J.C.STAFF Co., Ltd.",Light Novel,Adventure,~24min,TV-Series,13,2021
Golden Time,3.88 Excellent,"J.C.STAFF Co., Ltd.",Light Novel,Romantic Drama,~24min,TV-Series,24,2013
Tomodachi Game,3.89 Excellent,Okuruto Noboru Inc.,Manga,Thriller,~23min,TV-Series,12,2022
Bleach,3.88 Excellent,"Pierrot Co., Ltd.",Manga,Fighting-Shounen,~24min,TV-Series,366,2004
Durarara!! ×2 The First Arc,3.88 Excellent,Shuka Inc.,Light Novel,Thriller,~24min,TV-Series,12,2015
Nisemonogatari,3.88 Excellent,SHAFT Inc.,Light Novel,Ghost Stories,~24min,TV-Series,11,2012
Kaiju No. 8: Season 2,3.94 Excellent,"Production I.G., Inc.",Manga,Action Comedy,~24min,TV-Series,12,2025
Girls’ Last Tour,3.88 Excellent,"WHITE FOX Co., Ltd.",Manga,Adventure,~24min,TV-Series,12,2017
Fate/Grand Order Absolute Demonic Front: Babylonia,3.89 Excellent,CloverWorks Inc.,Video Game,Action Drama,~24min,TV-Series,21,2019
March Comes in Like a Lion,3.89 Excellent,SHAFT Inc.,Manga,Drama,~25min,TV-Series,22,2016
Fairy Tail: 100 Years Quest,3.91 Excellent,"J.C.STAFF Co., Ltd.",Manga,Fighting-Shounen,~24min,TV-Series,25,2024
MF Ghost: Season 2,3.94 Excellent,Felix Film,Manga,Ganbatte,~24min,TV-Series,12,2024
Mobile Suit Gundam: Iron-Blooded Orphans,3.89 Excellent,SUNRISE Inc.,Original Work,Action Drama,~25min,TV-Series,25,2015
